#,Cluster,DD Ref,Title (Brief Description),Full Description,Plain English Ask,DRI,Requires DG Review,Requires Cooley Review,Owner,Priority,Status,GDrive Location1,GDrive Location2,GDrive Location3,GDrive Location4,GDrive Location5,P53 Share,Rathgar Share,LOE,Likelihood,Output Format,Dependency,Owner Notes
1,General Corporate,I.A,Certificate of Incorporation & Bylaws,"The Company's certificate of incorporation and bylaws, including all amendments thereto.",Provide charter docs and all amendments,Legal,,,,High,Ready for Review,https://drive.google.com/drive/folders/0ALnnZ6-QJEhsUk9PVA ,https://drive.google.com/drive/folders/1s-3P_tSHZ8Ju6HM_QtE1eJNnh8YGDmWI,,,,,,Low,Certain,PDF,,
2,General Corporate,I.B,Board Minutes & Written Consents,"All minutes of all meetings of directors, committees of directors and stockholders of the Company. Copies of any written notices, if given, and any written consent to action without a meeting.",All board/committee/stockholder meeting minutes and written consents,Legal,,,,High,Ready for Review,https://drive.google.com/drive/folders/1HLShxWUrNDkBcQK5P0qOjoDNK_k2KMbF,https://drive.google.com/drive/folders/1sUYYDbCeVxZeUIAmB2hTCFD-fYsmNSGg,,,,,,Low,Certain,PDF,,
3,General Corporate,I.C,Board Committee Charters & Policies,Copies of charters of any committees of the Company's board of directors. Include any written policies established by the board of directors and any committee thereof.,Provide charters for each board committee and any board-level policies,Legal,,,,High,Not Started,https://drive.google.com/drive/folders/1FK6dgM33TamKFvyb45zQ1OUX6rLkoXX4,,,,,,,Low,Certain,PDF,,
4,General Corporate,I.D,Jurisdictions & Qualified Locations,"List of jurisdictions in which business is done, real property is owned or leased, employees or consultants reside or operate on behalf of the Company, or any material contractual relationships exist.","List every jurisdiction where Intercom does business, has property, employees, or material contracts",Legal,,,,Medium,Not Started,,,,,,,,Low,Certain,XLSX,,
5,General Corporate,I.E,Good Standing Certificates,Good standing certificates or equivalent from the Company's jurisdiction of incorporation and other jurisdictions in which it is qualified to do business.,Order fresh good standing certs from Delaware and each qualified state/country,Legal,,,,High,Not Started,,,,,,,,Low,Certain,PDF,Delaware SoS + states,
6,General Corporate,I.F,Equity Issuance Documents & Capital Stock History,"Please provide: (i) all equity issuance documents, whether or not such equity remains outstanding; (ii) all agreements pursuant to which the company has redeemed any shares of capital stock; (iii) all documents evidencing secondary transfers of capital stock; (iv) any convertible debt or similar instruments and agreements pursuant to which such instruments have converted into capital stock; and (v) any outstanding options, warrants or similar securities not governed by an equity incentive plan.","All equity issuance docs, redemptions, secondary transfers, convertible debt, and non-plan options/warrants",Legal,,,,High,Not Started,,,,,,,,Medium,Certain,ZIP of PDFs,,
7,General Corporate,I.G,Current & Former Directors and Officers,"List of all current and former directors and officers of the Company, including the dates of service of each such individual.",List all current and past directors/officers with start and end dates,Legal,,,,Medium,Not Started,https://docs.google.com/document/d/1TPvlexV30cAiz__rOhwz6CFT13EN6UOVft5PP6LXDc4,,,,,,,Low,Certain,XLSX,,
8,General Corporate,I.H,Subsidiaries & Corporate Org Structure,List of all subsidiaries (and any other entity in which the Company holds an equity interest) and corporate organizational structure of the Company.,List all subsidiaries and equity interests with org chart,Legal,,,,Medium,Not Started,https://drive.google.com/drive/folders/1NeRYcfeJGdR379HWnzhiA3RWUNyidnkF,https://drive.google.com/drive/folders/15cj3Vna9-tLDxei8g8VZYwY10NdSEeh2,,,,,,Low,Certain,PDF + XLSX,,
9,General Corporate,I.I,Subsidiary Corporate Information,"Corporate information regarding subsidiaries, i.e., ownership, date of acquisition of stock and/or assets and other materials relating to the establishment and operations of such subsidiaries. Copies of the equivalent docs with respect to each subsidiary as are requested in I.A and I.B above for Intercom, Inc.","For each subsidiary: ownership details, acquisition history, and equivalent charter docs/minutes as requested for parent",Legal,,,,Medium,Not Started,https://drive.google.com/drive/folders/1s-3P_tSHZ8Ju6HM_QtE1eJNnh8YGDmWI,,,,,,,Medium,Certain,ZIP of PDFs,,
10,General Corporate,I.J,Press Clippings & Releases,"Copies of all press clippings, press releases, media and trade information for the last [three] years.",Compile 3-year press release archive and notable media coverage,Comms,,,,Low,Not Started,,,,,,,,Low,Likely,PDF,,
11,General Corporate,I.K,Significant Events & M&A Approaches,"Description of all significant events in the Company's history since inception, including any bids, investment discussions, or M&A approaches received in the last 12 months.","Write a timeline of significant corporate events since founding, plus any inbound bids/investment approaches in last 12 months",Legal,,,,High,Not Started,,,,,,,,Medium,Certain,PDF,,
12,Capital Stock & Securities,II.A,Stock Records & Stockholder List,"Stock records and stock ledgers, including a list of all stockholders (including number of shares held by each) as of the most recent practicable date and current beneficial ownership lists.",Provide cap table with all stockholders and share counts as of most recent date,Legal,,,,High,Not Started,https://drive.google.com/drive/folders/1dDiQryTrY8uk2XbZtFrUB8pXUselesTo,,,,,,,Low,Certain,XLSX,,
13,Capital Stock & Securities,II.B,"Outstanding Options, SARs, Warrants, Convertibles","List of all outstanding options, stock appreciation rights, warrants and convertible securities. Include, if applicable, (i) the names of the issuees or grantees; (ii) the amounts issued or granted and the amount of any portion exercised; (iii) the dates of issuances or grants; (iv) the plan under which issuance or grant occurred; (v) the consideration received; (vi) the exercise prices; (vii) the vesting schedules; and (viii) the expiration dates.","Full option/warrant/convertible detail from Carta: holder name, grant date, shares, exercise price, vesting, expiration",Legal,,,,High,Not Started,https://drive.google.com/drive/folders/1VNKPkJPjkdpJxFRQ-YqyiTs3ijZWtuNM,,,,,,,Low,Certain,XLSX,,
14,Capital Stock & Securities,II.C,Equity Incentive Plans & Forms,"All employee, director or consultant stock options, stock purchase, stock bonus and any other equity incentive plans (including any forms of option agreement and stock restriction agreement), options, warrants, convertible instruments, pledges, contracts, plans, investment letters, arrangements or commitments relating to the securities of the Company and its subsidiaries and affiliates (whether authorized and unissued, treasury or outstanding). Include copies of all stock option agreements containing terms that are different than those terms contained in the form of stock option agreement provided by the Company.","All equity plan documents, form agreements, and any non-standard option agreements",Legal,,,,High,Not Started,https://docs.google.com/spreadsheets/d/1t5WO-VvIUh9refrSwXUZsjpThLgQpG9i8Pt-tYjpOww,,,,,,,Low,Certain,ZIP of PDFs,,
15,Capital Stock & Securities,II.D,Shareholder Agreements & Voting Rights,"Agreements relating to the ownership and control of the Company (if any), including all shareholder or member agreements, voting trusts and voting agreements, proxies, transfer restriction agreements, preemptive rights agreements, registration agreements, stock purchase rights, co-sale rights, redemption, rights of first refusal, take-along or bring-along rights, antidilution rights, preemptive or other preferential rights to acquire or dispose of securities and any waivers thereof.","All shareholder agreements: voting, ROFR, co-sale, registration rights, anti-dilution, and any waivers",Legal,,,,High,Not Started,https://drive.google.com/drive/folders/1AFKWSsfjaNDtlhbUWTaLMm0fXjdZ7bOn,https://drive.google.com/drive/folders/1TjZYRsUsG3xcndUcK5D1EvxM6B7kd_-R,,,,,,Low,Certain,ZIP of PDFs,,
16,Capital Stock & Securities,II.E,Change of Control Agreements,All agreements restricting or providing rights upon changes in control of the Company.,Any agreements triggered by a change of control (beyond equity acceleration),Legal,,,,High,Not Started,https://docs.google.com/spreadsheets/d/1LfQXQXe2rk7hOs-g232QfP46WXaywg6p,,,,,,,Medium,Certain,PDF,,
17,Capital Stock & Securities,II.F,Other Securities Sales Agreements,"Any other agreements relating to sales of securities by the Company, including any offering circulars.",Any other securities sales docs or offering circulars,Legal,,,,Medium,Not Started,,,,,,,,Low,Likely,PDF,,
18,Capital Stock & Securities,II.G,Securities Qualifications / Blue Sky,Evidence of qualification or exemption under applicable federal securities regulations and state blue sky laws for the issuance or transfer of securities of the Company.,Blue sky / securities compliance filings or exemptions,Legal,,,,Low,Not Started,,,,,,,,Low,Likely,PDF,,
19,Capital Stock & Securities,II.H,Securities Permits,Applications for permits and permits for issuance or transfer of securities.,Any permits for securities issuance/transfer,Legal,,,,Low,Not Started,,,,,,,,Low,Unlikely,PDF,,
20,Capital Stock & Securities,II.I,Dividend Agreements,Any agreements relating to (or restricting) the payment of dividends.,Confirm no dividend agreements exist (Intercom has not declared dividends),Legal,,,,Low,Not Started,,,,,,,,Low,Likely,PDF memo,,
21,Capital Stock & Securities,II.J,Recapitalizations & Restructurings,"Documents relating to recapitalizations, reorganizations or significant restructurings (including any reincorporation).","Any recapitalization, reorg, or restructuring documents",Legal,,,,Medium,Not Started,,,,,,,,Low,Likely,PDF,,
22,Capital Stock & Securities,II.K,Financing Transaction Documents,"All documents relating to any debt, equity, or other financing transactions, including sources and uses of funds and all material correspondence with lenders or stockholders (including compliance reports and notices of default or waiver).","All financing docs: debt, equity, S&U, lender correspondence, compliance reports, default notices",Legal,,,,High,Not Started,,,,,,,,Medium,Certain,ZIP of PDFs,,
23,Acquisitions & Divestitures,III.A,Prior Acquisition/Divestiture Agreements,"Agreements relating to (i) the acquisition or divestiture of equity interests in other companies, businesses or significant assets, and (ii) mergers, consolidations, reorganizations or similar corporate transactions.","Any past acquisition, divestiture, or merger agreements",Legal,,,,Medium,Not Started,,,,,,,,Medium,Likely,PDF,,
24,Acquisitions & Divestitures,III.B,Current Plans/Negotiations for Transactions,"Description of current plans or negotiations (and copies of any existing reports, analyses, letters of intent or term sheets) relating to transactions of the type described above.","Current deal process materials — privileged, Cooley to review before production",Legal,,,,High,Not Started,,,,,,,,Low,Certain,PDF,Cooley review,
25,Acquisitions & Divestitures,III.C,No-Shop / Exclusivity / ROFR,"Agreements containing (i) any 'no-shop' or exclusivity obligation, or (ii) any right of first refusal, right of first offer or right of negotiation with respect to any acquisition transaction.","Confirm whether any no-shop, exclusivity, or ROFR obligations exist from prior processes",Legal,,,,High,Not Started,,,,,,,,Low,Certain,PDF memo,,
26,Financial Information,IV.A,Financial Statements (3 Years),"Copies of any financial statements for the Company prepared for the last [three] fiscal years (both audited and unaudited), including balance sheets, statements of operation, cash flow statements and statements of stockholders equity.","3-year audited and unaudited financial statements (P&L, BS, CF, equity)",Accounting,,,,High,Not Started,https://drive.google.com/drive/folders/1cmeBKcQdExMVhHFdVpqE744zv6Mb-edl,https://drive.google.com/drive/folders/1yTwE2GOG-0TXMZdgtLrUMiYlx151xjHd,,,,,,Low,Certain,PDF + XLSX,,
27,Financial Information,IV.B,Accounts Receivable & Aging,"(i) Accounts receivable and aging schedule by quarter for the last [three] fiscal years and schedule of individual account balances as of most recent practicable date; (ii) copies of all current credit policies, normal trade terms and special trade terms; and (iii) summary of all accounts in dispute, in process of legal collection or write-offs within the last [three] years.","Quarterly AR aging (3 years), current individual balances, credit policies, trade terms, disputed accounts summary",Accounting,,,,High,Not Started,,,,,,,,Medium,Certain,XLSX,,
28,Financial Information,IV.C,Other Receivables,Schedule of other receivables of the Company (other than accounts receivable) as of most recent practicable date (including description of their terms and repayment dates).,List all non-AR receivables with terms and repayment dates,Accounting,,,,Medium,Not Started,,,,,,,,Low,Certain,XLSX,,
29,Financial Information,IV.D,Prepaid Expenses & Other Assets,Schedule of material prepaid expenses and 'other assets' as of most recent practicable date and a general description of each item.,Schedule of material prepaids and other assets with descriptions,Accounting,,,,Medium,Not Started,,,,,,,,Low,Certain,XLSX,,
30,Financial Information,IV.E,AR Reserve Activity (3 Years),"Schedule of accounts receivable reserve activity, including charges against the reserve for the last [three] years.","3-year AR reserve roll: charges, recoveries, write-offs by quarter",Accounting,,,,Medium,Not Started,,,,,,,,Medium,Certain,XLSX,,
31,Financial Information,IV.F,PP&E Schedule,"Schedule of property, plant and equipment and accumulated depreciation broken down into category for the last fiscal year (indicating beginning balances, additions, retirements and ending balances).",PP&E roll-forward by category with depreciation,Accounting,,,,Medium,Not Started,https://docs.google.com/spreadsheets/d/1RmjdPHchSSw0NpTGIK_cz43kolNOlrLl,https://docs.google.com/spreadsheets/d/1QoFXzNUGd8_pU6x7-wC1wu0jaWAVT0Bk,,,,,,Medium,Certain,XLSX,,
32,Financial Information,IV.G,Book/Tax Basis Differences (PP&E),"Schedule of the differences between the book and tax basis of property, plant and equipment as of most recent practicable date.",Book vs. tax depreciation reconciliation,Accounting,,,,Medium,Not Started,,,,,,,,Medium,Likely,XLSX,External tax advisors,
33,Financial Information,IV.H,Intangible Assets Schedule,Schedule of intangible assets as of most recent practicable date (showing the book basis and amortization policy with respect thereto) and a general description of each item.,"Intangibles schedule with book basis, amortization, and descriptions",Accounting,,,,Medium,Not Started,,,,,,,,Medium,Certain,XLSX,,
34,Financial Information,IV.I,Accounts Payable & Aging,Accounts payable and aging as of most recent practicable date.,Current AP aging snapshot,Accounting,,,,Medium,Not Started,,,,,,,,Low,Certain,XLSX,,
35,Financial Information,IV.J,Liabilities by Category,"Schedule of all liabilities by category (trade payables, notes payable, accrued liabilities, etc.) as of most recent practicable date including compensatory based accruals.","Categorized liabilities: trade payables, notes, accrued liabilities, comp accruals",Accounting,,,,Medium,Not Started,,,,,,,,Medium,Certain,XLSX,,
36,Financial Information,IV.K,Contingent Liabilities / Earn-outs,Schedule of any contingent liabilities and/or earn-out payments payable by the Company as of most recent practicable date.,List any contingent liabilities or earn-out obligations,Accounting,,,,Medium,Not Started,,,,,,,,Low,Certain,PDF memo,,
37,Financial Information,IV.L,Material Projects in Progress,"List of material projects currently being worked on (indicating the stage of completion, the expenditures to date and the expenditures needed for completion).","List material projects with completion %, spend-to-date, and spend-to-complete",Finance,,,,Medium,Not Started,,,,,,,,Medium,Likely,XLSX,,
38,Financial Information,IV.M,Sales/Margin Analysis (3 Years),"(i) analysis of sales, cost of sales and direct selling, general and administrative expenses for the last [three] years; and (ii) analysis of gross profit percentages for the last [three] years.","3-year revenue, COGS, SG&A, and gross margin analysis",Finance,,,,High,Not Started,,,,,,,,Low,Certain,XLSX,,
39,Financial Information,IV.N,Off-Balance Sheet Arrangements,Agreements and other documents relating to off-balance sheet arrangements.,Confirm no off-balance sheet arrangements (or document any),Accounting,,,,Medium,Not Started,,,,,,,,Low,Certain,PDF memo,,
40,Financial Information,IV.O,Revenue Recognition & Internal Controls,Copy of revenue recognition policies and a description of the internal controls.,Revenue recognition policy document and internal controls description,Accounting,,,,High,Not Started,https://app.box.com/folder/326587967726,,,,,,,Low,Certain,PDF,,
41,Financial Information,IV.P,Deferred Revenue Schedule,Detailed schedule and description of deferred revenue.,Deferred revenue schedule with detail,Accounting,,,,High,Not Started,,,,,,,,Medium,Certain,XLSX,,
42,Financial Information,IV.Q,Financial Commitments Schedule,"Schedule of all material financial commitments outstanding (including, without limitation, inventory purchases, fixed asset purchases, tax holidays, hedging contracts, and profit-sharing, bonus and commission commitments).",Comprehensive schedule of all outstanding financial commitments,Finance,,,,Medium,Not Started,,,,,,,,Medium,Certain,XLSX,,
43,Financial Information,IV.R,Judgmental Reserves & Accruals (3yr quarterly),"Schedule showing the historical activity of all judgmental reserves and accruals for the past [three] years by quarter, including commissions and bonuses.","Quarterly reserve activity: commissions, bonuses, warranties, etc. for 3 years",Accounting,,,,High,Not Started,,,,,,,,High,Certain,XLSX,,
44,Financial Information,IV.S,Royalty/License Fee Schedule,"Schedule of all agreements for royalties, license fees and other fees triggered by sales or licenses of products.",List any sales-triggered royalty or license fee agreements,"Tommy Bettles, Legal",,,,Low,Not Started,,,,,,,,Low,Likely,PDF or XLSX,,
45,Financial Information,IV.T,Budget & Forecasts,"Budget/financial forecast for the last, current and any future fiscal years (together with variance from budget).","Budget and forecast (last, current, future FYs) with variance analysis",Finance,,,,High,Not Started,,,,,,,,Low,Certain,XLSX,,
46,Financial Information,IV.U,Internal Controls / CEO-CFO Materials,All reports and other materials prepared by or on behalf of the chief executive officer or chief financial officer regarding internal controls or disclosure controls and procedures.,CEO/CFO materials on internal controls and disclosure procedures,Accounting,,,,Medium,Not Started,,,,,,,,Medium,Certain,PDF,,
47,Financial Information,IV.V,Disclosure Controls Evaluation,All materials prepared in connection with the Company's evaluation of its disclosure controls and procedures.,Materials from disclosure controls evaluation,Accounting,,,,Medium,Not Started,,,,,,,,Medium,Likely,PDF,,
48,Financial Information,IV.W,Auditor Correspondence on Controls,All correspondence between the chief executive officer and the chief financial officer and the Company's auditors and audit committee relating to any deficiencies in the design or operation of the internal controls.,CEO/CFO correspondence with auditors re any internal control deficiencies,Accounting,,,,Medium,Not Started,,,,,,,,Medium,Certain,PDF,,
49,Financial Information,IV.X,Auditor Work Papers & Management Letters,(i) auditor work papers for the last [three] fiscal years; (ii) management comment letters issued by auditors for the last [three] fiscal years; and (iii) access to audit manager and/or audit partner.,"3 years of audit work papers, management letters, and auditor access",Accounting,,,,High,Not Started,,,,,,3. Audit,,Medium,Certain,ZIP of PDFs,External auditors,
50,Financial Information,IV.Y,Management Projections / Business Plan,"Projections prepared by management, including business plan, for the next [three] fiscal years.",Management case projections and business plan (next 3 FYs),Finance,,,,High,Not Started,,,,,,,,Low,Certain,XLSX + PDF,,
51,Financial Information,IV.Z,Outside Consultant Reports,"Reports and studies prepared by outside consultants with respect to the Business, within the last [three] fiscal years.","Analyst/consultant reports (Gartner, Forrester, IDC, etc.)","Tommy Bettles, Legal",,,,Medium,Not Started,https://drive.google.com/drive/folders/1MQb6oLZQQq_mtFYORvm3sPBwOFYPWZWe,,,,,,,Low,Certain,ZIP of PDFs,,
52,Financial Information,IV.AA,Monthly Trial Balances (2 Years),"Monthly trial balances (P&L, balance sheet, and cash flow statement) for the past two fiscal years, reconciling to consolidated financial statements, with expense breakdowns by headcount versus non-headcount costs and by cost of sales versus operating expense categories.","Monthly P&L/BS/CF for 2 years, reconciled to consolidated, with HC vs non-HC and COS vs OpEx splits",Accounting,,,,High,Not Started,,,,,,,,High,Certain,XLSX,,
53,Financial Information,IV.BB,Consolidating Financial Statements (3 Years),"Consolidating income statement and balance sheet for each of the past three fiscal years, showing results by legal entity, reconciled to the consolidated financial statements.","3-year consolidating P&L and BS by legal entity, reconciled to consolidated",Accounting,,,,High,Not Started,,,,,,,,High,Certain,XLSX,,
54,Financial Information,IV.CC,Board Presentation Materials (4 Quarters),"Copies of internal management reports, board presentation materials, and board decks for the past four quarters.",Last 4 quarters of board decks and internal management reports,Finance,,,,High,Not Started,,,,,,,,Low,Certain,ZIP of PDFs,,
55,Financial Information,IV.DD,Customer Revenue Detail,"Listing of all commercial arrangements with active customers, including products and services purchased, at least two years of revenue per customer, and identification of whether sales are direct or through a channel.","Full customer list with products purchased, 2-year revenue per customer, and direct vs. channel flag",Finance,,,,High,Not Started,,,,,,,,High,Certain,XLSX,,
56,Financial Information,IV.EE,Deferred Revenue Waterfall,Deferred revenue waterfall schedule and unbilled deferred revenue (contract assets) waterfall schedule.,Deferred revenue and unbilled contract assets waterfall schedules,Accounting,,,,High,Not Started,,,,,,,,High,Certain,XLSX,,
57,Financial Information,IV.FF,Vendor Payment Detail,"List of all active vendors by total payments made over the past two fiscal years, including a description of services provided by each vendor and monthly payment history for the top vendors.","Active vendor list with 2-year payments, service descriptions, and monthly payment history for top vendors",Accounting,,,,Medium,Not Started,,,,,,,,Medium,Certain,XLSX,,
58,Financial Information,IV.GG,Product SKU Price List,Current price list for all product SKUs (distinguishing active from inactive) and applicable services rate cards.,Current pricing: all SKUs (active/inactive) and services rate cards,Finance,,,,High,Not Started,,,,,,,,Low,Certain,XLSX,,
59,Financial Information,IV.HH,Employee Fringe Benefit Costs,"Schedule of employee fringe benefit costs (e.g., insurance, paid time off, payroll taxes) expressed as a percentage of total compensation, by jurisdiction or employee category.","Fringe benefit cost schedule as % of comp, by jurisdiction or employee category",Accounting,,,,Medium,Not Started,,,,,,,,Medium,Certain,XLSX,,
60,Financial Information,IV.II,Bad Debt & Deferred Commissions,"Historical write-offs and bad debt provisions for accounts receivable and unbilled contract assets, by customer, for the past three fiscal years, and deferred commissions amortization waterfall.",3-year write-offs/bad debt by customer + deferred commissions amortization waterfall,Accounting,,,,Medium,Not Started,,,,,,,,High,Certain,XLSX,,
61,Employment Matters,V.A,Organization Chart,"Organization chart of the Company, including description of reporting relationships.",Current org chart with reporting lines,Finance,,,,Medium,Not Started,,,,,,,,Low,Certain,PDF,,
62,Employment Matters,V.B,Comprehensive Employee Census,"A list of employees including hire date, position title, manager name, department name, work location, status (part time/full time/fixed term), compensation, overtime eligibility, employing legal entity, and details of any employees currently on leave. Compensation details should include salary, bonus, commission and deferred salary pursuant to any plans, and any other forms of compensation paid to each employee in the last full fiscal year and to be paid in the current fiscal year.","Full employee census: name, title, manager, dept, location, status, legal entity, OT eligibility, leave status, plus full comp detail (salary, bonus, commission, deferred, perks) for last and current FY","People, Accounting",,,,High,Not Started,,,,,,,,High,Certain,XLSX,,
