#,Cluster,DD Ref,Title (Brief Description),Full Description,Plain English Ask,DRI,Requires DG Review,Requires Cooley Review,Owner,Priority,Status,GDrive Location1,GDrive Location2,GDrive Location3,GDrive Location4,GDrive Location5,P53 Share,Rathgar Share,LOE,Likelihood,Output Format,Dependency,Owner Notes
134,Privacy & Information Security,VIII.E,Sensitive/Special Data Categories,"For each category of individuals listed above, identify the types of personal data processed including any sensitive information.","Flag any SSNs, financial, biometric, health, genetic, geolocation, children's data","Legal, Security Team",false,,,High,Not Started,,,,,,,,Medium,Certain,PDF or XLSX,,
135,Privacy & Information Security,VIII.F,Number of Data Subjects by Country,"Identify the approximate number of unique individuals as to whom the Company processes personal data on an annual basis, and by country.","Count unique data subjects processed annually, broken down by country","Engineering, Security Team",false,,,Medium,Not Started,,,,,,,,Medium,Certain,XLSX,,
136,Privacy & Information Security,VIII.G,Data Retention Policies,How long does the Company retain personal data?,Data retention policy document,Security Team,false,,,Medium,Not Started,,,,,,,,Low,Certain,PDF,,
137,Privacy & Information Security,VIII.H,Third-Party Data Sharing,Does the Company disclose personal data to any third party other than its pure service providers/processors?,"List sub-processors, data recipients, purposes, types of data shared","Legal, Security Team",false,,,High,Not Started,,,,,,,,Medium,Certain,XLSX + PDF,,
138,Privacy & Information Security,VIII.I,Data Sources,Describe the sources from which the Company obtains personal data.,"Data sources: direct collection, customers, internet, brokers, lead generators, partners",Security Team,false,,,Medium,Not Started,,,,,,,,Medium,Likely,PDF,,
139,Privacy & Information Security,VIII.J,Session Replay / Tracking Technologies,"Does the Company utilize session replay technologies, third-party chatbots, or advertising tracking technologies?","List cookies, analytics, session replay, chatbots, ad tracking tools and purposes","Engineering, Marketing",false,,,Medium,Not Started,,,,,,,,Low,Likely,PDF memo,,
140,Privacy & Information Security,VIII.K,Applicable Privacy Laws & Compliance,"Identify the privacy and information security laws and industry standards the Company believes apply to it, and what steps taken to comply.","List applicable laws (GDPR, CCPA, PIPEDA, AI Act, etc.) and compliance measures","Legal, Security Team",false,,,High,Not Started,,,,,,,,Medium,Certain,PDF,,
141,Privacy & Information Security,VIII.L,Standard DPA / Privacy Provisions,Provide a copy of the Company's standard privacy or security-related contractual provisions.,"DPA template, MSA privacy provisions, info security schedules",Legal,false,,,Medium,Not Started,,,,,,,,Low,Certain,PDF,,
142,Privacy & Information Security,VIII.M,InfoSec Program Description,"Describe the Company's information security program and provide copies of documented policies, procedures and standards.","InfoSec program narrative: training, phishing tests, tabletop exercises, bug bounty, disaster recovery, incident response, vendor management, change control policies",Security Team,false,,,High,Not Started,,,,,,,,Medium,Certain,PDF + ZIP,,
143,Privacy & Information Security,VIII.N,Security Assessments / Pen Tests / Certs (3yr),"Provide copies of all security assessments, vulnerability scans, penetration tests, audits, certifications conducted in the past three years.","SOC 2, pen test reports, ISO/NIST/PCI certifications for last 3 years",Security Team,false,,,High,Not Started,,,,,,,,Medium,Certain,ZIP of PDFs,,
144,Privacy & Information Security,VIII.O,Unremediated Vulnerabilities,"To the extent any documentation includes unremediated security vulnerabilities, describe how addressed and timing for remediation.",Current vulnerability summary with remediation status and timelines,Security Team,false,,,High,Not Started,,,,,,,,Medium,Certain,PDF or XLSX,,
145,Privacy & Information Security,VIII.P,Security Incident History,"List and describe all actual, reasonably suspected or alleged security incidents.","3-year incident log: data breaches, cyber-attacks, ransomware, account compromise, extortion","Legal, Security Team",false,,,High,Not Started,,,,,,,,Medium,Certain,PDF,,
146,Privacy & Information Security,VIII.Q,Regulatory Complaints (Privacy),"Has the Company received any complaints, demands, claims, regulatory inquiries related to privacy or information security?","Confirm none or list any privacy/security regulatory complaints, demands, or investigations",Legal,false,,,Medium,Not Started,,,,,,,,Low,Certain,PDF memo,,
147,Privacy & Information Security,VIII.R,Cyber Insurance Policy,Provide a copy of the Company's cyber-insurance policy and any claims.,Cyber insurance policy and claims history,"Finance, Legal",false,,,Medium,Not Started,,,,,,,,Low,Certain,PDF,Insurance broker,
148,Privacy & Information Security,VIII.S,Data Breach History (10 Years),"Has the company experienced any data breaches, cybersecurity incident, or unauthorized access into its IT systems during the past ten years?",10-year data breach/cybersecurity incident history,"Legal, Security Team",false,,,High,Not Started,,,,,,,,Medium,Certain,PDF,,
149,Privacy & Information Security,VIII.T,Breach Detection Systems & Processes,"What systems and processes does the company have in place to detect data breaches, cybersecurity incidents, and/or unauthorized access?","Describe breach detection systems, SIEM, monitoring, alerting capabilities",Security Team,false,,,Medium,Not Started,,,,,,,,Medium,Certain,PDF,,
150,Privacy & Information Security,VIII.U,Non-Compliance Instances,Identify any instances of noncompliance with privacy/security laws or contractual obligations.,Confirm none or document any non-compliance instances,"Legal, Security Team",false,,,Medium,Not Started,,,,,,,,Low,Likely,PDF memo,,
151,Privacy & Information Security,VIII.V,Call Recording / Email Marketing Compliance,"Does the Company engage in call recording, email marketing, text messaging, telemarketing, or auto-dialed/AI calls?","TCPA, CAN-SPAM, ePrivacy compliance confirmation",GTM Ops,false,,,Low,Not Started,,,,,,,,Low,Likely,PDF memo,,
152,Privacy & Information Security,VIII.W,Sanctioned Country Arrangements,Does the Company enter into contracts with third parties located in or associated with sanctioned countries?,OFAC compliance confirmation — sanctioned country arrangements,Legal,false,,,Medium,Not Started,,,,,,,,Low,Likely,PDF memo,,
153,Privacy & Information Security,VIII.X,Comprehensive Data Inventory & Mapping,"Comprehensive data inventory and mapping for all data processed by the Company, including type, purpose, source, legal basis, retention, geographic location, access controls, third-party sharing, and controller vs processor distinction.","Full data inventory: type, purpose, source, legal basis, retention, location, access controls, sharing, controller/processor role","Legal, Security Team",false,,,High,Not Started,,,,,,,,High,Certain,XLSX + PDF,,
154,Privacy & Information Security,VIII.Y,Service Provider & Sub-Processor List,"List of all service providers, sub-processors, and other third parties that access Company data, including which support which products/services.",Complete sub-processor/service provider list mapped to products/services they support,"Legal, Security Team",false,,,High,Not Started,,,,,,,,Medium,Certain,XLSX,,
155,Privacy & Information Security,VIII.Z,"PIAs, ROPAs & Cross-Border Transfer Docs","Copies of all privacy impact assessments, ROPAs, data retention schedules, and cross-border transfer mechanism documentation (SCCs, BCRs, DPF certifications).","PIAs, Records of Processing Activities, retention schedules, SCCs/BCRs/DPF documentation","Legal, Security Team",false,,,High,Not Started,,,,,,,,High,Certain,ZIP of PDFs,,
156,Privacy & Information Security,VIII.AA,Physical Security Incidents,Description of any physical security incidents at Company premises that may have resulted in data compromise.,Any physical break-ins or thefts that may have compromised data processing equipment,Security Team,false,,,Medium,Not Started,,,,,,,,Low,Likely,PDF memo,,
157,Privacy & Information Security,VIII.BB,FedRAMP & Government Data Hosting,"Confirmation of FedRAMP status and description of government data hosting, applicable security standards, and related audits.",Confirm FedRAMP status (likely N/A) and any government data hosting arrangements,Security Team,false,,,Low,Not Started,,,,,,,,Low,Unlikely,PDF memo,,
158,Agreements & Commitments,IX.A,Bank Lines of Credit,"Bank lines of credit agreements, including any amendments, renewal letters, notices, etc. and other outstanding loan agreements or guarantees.","All bank credit agreements, amendments, and loan guarantees",Legal,false,,,High,Not Started,https://drive.google.com/drive/folders/1ErgD1sgL9PHP2fEeOMdOL6rU92tmrmxK,https://drive.google.com/drive/folders/1JYza7j76b-tPe1iVr2shoGbhzpLjdBpD,,,,,,Low,Certain,ZIP of PDFs,,
159,Agreements & Commitments,IX.B,"Debt Securities, Liens & Security Agreements","All debt securities or instruments, notes, guarantees and loan or credit agreements, and all mortgages, liens, pledges, indemnifications, security agreements, UCC or other financing statements.","All debt instruments, security agreements, UCC filings, liens, and guarantees",Legal,false,,,High,Not Started,https://drive.google.com/drive/folders/1RPVVuY9gi9Sl4U9Yg3wZt4ZnuzSOXlLM,https://drive.google.com/drive/folders/1HeeiijSjHCp2eiopZAsCVug9xzARhAL-,https://drive.google.com/drive/folders/1NLSxPbkhOWIROkyKgNJnc3KjM1rU_-Gz,,,,,Low,Certain,ZIP of PDFs,,
160,Agreements & Commitments,IX.C,D&O / Indemnification Insurance,"All agreements or insurance policies insuring or providing for indemnification of any director, officer or employee.",D&O insurance policy and any indemnification agreements,Legal,false,,,High,Not Started,,,,,,,,Low,Certain,PDF,,
161,Agreements & Commitments,IX.D,Related Party Transactions,"All agreements currently in force and a description of all transactions within the last three years between the Company and persons who were or are directors, officers, or >5% owners.","3-year schedule of related party transactions (directors, officers, 5%+ holders)",Legal,false,,,High,Not Started,https://drive.google.com/drive/folders/1qEKZ63fss-ZVVM3ss8DD7AU3vy5-MD9x,,,,,,,Medium,Certain,PDF + XLSX,,
162,Agreements & Commitments,IX.E,Charitable Contributions,All charitable contributions made by the Company to organizations in which directors also serve as directors.,List charitable contributions cross-referenced with board director affiliations,Accounting,false,,,Low,Not Started,,,,,,,,Low,Likely,XLSX,,
163,Agreements & Commitments,IX.F,Standard Customer Agreements,Standard form of customer agreements and actual customer agreements with any/all customers.,Standard customer terms (ToS) and top customer agreements,Legal,false,,,High,Not Started,,,,,,,,Low,Certain,PDF + ZIP,,
164,Agreements & Commitments,IX.G,Internal Negotiation Playbooks,"Standard form templates and internal negotiation playbooks used in dealings with customers, distributors, service providers, and suppliers.",Internal negotiation playbooks and standard form templates for customer/vendor deals,Legal,false,,,Medium,Not Started,,,,,,,,Medium,Likely,PDF,,
165,Agreements & Commitments,IX.H,Non-Standard Customer Agreements,"Agreements relating to any non-standard customer agreements, support terms or other obligations.",All customer agreements with non-standard terms,Legal,false,,,Medium,Not Started,,,,,,,,Medium,Certain,ZIP of PDFs,,
166,Agreements & Commitments,IX.I,Partnerships / JVs,"Joint venture, partnership or similar agreements.",Partnership/JV agreements (Intercom GP Partnership Agreement),Legal,false,,,Medium,Not Started,https://drive.google.com/drive/folders/1ePnmIdpSCe4Hdo709II3rS-rwryN2XHu,,,,,,,Low,Certain,PDF,,
167,Agreements & Commitments,IX.J,Service Provider Agreements,"Maintenance and service agreements, including agreements with advertising agencies, investment bankers, attorneys, consultants, brokers and other service providers.","All material service provider contracts (advisors, consultants, bankers, etc.)",Legal,false,,,Medium,Not Started,https://drive.google.com/drive/folders/1W4NYXFn_gREUoi0P7h3I1Oz5KTpaF22p,https://docs.google.com/spreadsheets/d/1R6zgsqEdJsSX70YjyX8E18rwShDxZWbJ,,,,,,Medium,Certain,ZIP of PDFs,,
168,Agreements & Commitments,IX.K,Supplier Agreements & Material Suppliers,Supplier agreements. List of material suppliers (indicating sole/single sources).,Material supplier contracts and list identifying sole/single source suppliers,Legal,false,,,Medium,Not Started,,,,,,,,Low,Certain,XLSX + PDF,,
169,Agreements & Commitments,IX.L,Distribution / Reseller Agreements (Inbound),"Agreements in which the Company has been appointed as a partner, OEM, VAR, reseller, or distributor by a third party, including associated spend and revenue.","Agreements where Intercom is appointed as partner/reseller, with spend and revenue data",Legal,false,,,Medium,Not Started,,,,,,,,Medium,Likely,XLSX + PDF,,
170,Agreements & Commitments,IX.M,Distribution / Reseller Agreements (Outbound),"Agreements in which the Company has appointed another party as a partner, OEM, VAR, reseller, or distributor, including associated revenues.","Agreements where Intercom appoints third parties as resellers/distributors, with revenue data",Legal,false,,,Medium,Not Started,,,,,,,,Medium,Likely,XLSX + PDF,,
171,Agreements & Commitments,IX.N,NDA List,List of confidentiality and nondisclosure agreements.,NDA inventory,Legal,false,,,Medium,Not Started,https://drive.google.com/drive/folders/1xSIwdBN69veCfuRnmngVZoYmYKTyMdii,https://drive.google.com/drive/folders/1uz4smicxZfCkwqwa3A1t6rekq3CBSt23,,,,,,Low,Certain,XLSX,,
172,Agreements & Commitments,IX.O,Competitor Agreements,Agreements with competitors of the Company.,Any agreements with competitors,Legal,false,,,Medium,Not Started,,,,,,,,Low,Likely,PDF,,
173,Agreements & Commitments,IX.P,Product Warranties & Claims,Product warranties. Description of product warranty claims history during the last three years.,Product warranty terms and 3-year claims history,Legal,false,,,Medium,Not Started,,,,,,,,Medium,Likely,PDF + XLSX,,
174,Agreements & Commitments,IX.Q,Non-Compete / Restrictive Covenants on Company,"Agreements restricting the Company's right to compete, acquire, sell, develop, distribute, or solicit.",Confirm no restrictive covenants on the Company (P53 confirmed NONE),Legal,false,,,Medium,Not Started,,,,,,,,Low,Certain,PDF memo,,
175,Agreements & Commitments,IX.R,Other Material Agreements / Breach Correspondence,Other agreements material to the Company or entered outside ordinary course. Correspondence relating to actual or alleged breaches.,Material non-ordinary-course agreements and any breach correspondence,Legal,false,,,Medium,Not Started,,,,,,,,Medium,Certain,PDF,,
176,Agreements & Commitments,IX.S,Government Contracts & ITAR Agreements,"All agreements between the Company and any governmental body or agency, or any government-owned or state-owned enterprise, including agreements requiring ITAR compliance.","Government contracts, agreements with state-owned enterprises, ITAR-related arrangements",Legal,false,,,Medium,Not Started,,,,,,,,Medium,Likely,PDF,,
177,Agreements & Commitments,IX.T,"Government Grants, GWACs, CRADAs & OTAs","All government contracts, grants, cooperative agreements, and related arrangements (GWACs, CRADAs, OTAs), including pending bids, performance reports (CPARs), and small business certifications.","Government grants/contracts (including IDA grants), pending bids, CPARs, and certifications",Legal,false,,,Medium,Not Started,,,,,,,,Medium,Likely,PDF + XLSX,,
178,Litigation & Insurance,X.A,Pending/Settled Litigation,"List and brief description of litigation, claims and proceedings, and whether pending, settled or concluded.","Litigation log: all claims, status (pending/settled/concluded)",Legal,false,,,High,Not Started,https://drive.google.com/drive/folders/0AClyGu1Q11w_Uk9PVA,,,,,,,Low,Certain,XLSX,,
179,Litigation & Insurance,X.B,Threatened Litigation,"List and brief description of litigation, claims and proceedings that are threatened or pending.",Threatened claims and proceedings against the Company or employees,Legal,false,,,High,Not Started,https://drive.google.com/drive/folders/0AClyGu1Q11w_Uk9PVA,,,,,,,Low,Certain,XLSX,,
180,Litigation & Insurance,X.C,"Consent Decrees, Injunctions, Settlements","Consent decrees, injunctions, judgments, other decrees or orders, settlement agreements.","All consent decrees, injunctions, judgments, and settlement agreements",Legal,false,,,High,Not Started,,,,,,,,Low,Certain,PDF,,
181,Litigation & Insurance,X.D,Attorneys' Letters to Auditors,Attorneys' letters to auditors within the last five fiscal years and current fiscal year to date.,5 years of attorneys' letters to auditors,Legal,false,,,Medium,Not Started,,,,,,,,Low,Certain,PDF,,
182,Litigation & Insurance,X.E,Litigation Correspondence & Pleadings,Correspondence and pleadings regarding the foregoing matters.,All correspondence and pleadings for litigation matters,Legal,false,,,Medium,Not Started,,,,,,,,Medium,Certain,ZIP of PDFs,,
183,Litigation & Insurance,X.F,Insurance Policies (All Material),"All material insurance arrangements including copies of all current insurance policies (property, liability, product liability, D&O, cyber, key employee) and description of pending claims or exposures.","All current insurance policies (property, liability, D&O, cyber, key employee) with pending claims/exposures","Finance, Legal",false,,,High,Not Started,,,,,,,,Medium,Certain,ZIP of PDFs,,
184,Litigation & Insurance,X.G,Insurance Claims History,List and brief description of potential claims or lawsuits for which the Company has provided notice to any insurer or sought coverage.,"Insurance claims filed: description, insurer, status","Accounting, Legal",false,,,Medium,Not Started,,,,,,,,Low,Certain,XLSX,Insurance broker,
185,Litigation & Insurance,X.H,Self-Insurance Programs,"Describe self-insurance programs, retrospective premium programs or captive insurance programs.",Confirm no self-insurance programs (likely N/A),Accounting,false,,,Low,Not Started,,,,,,,,Low,Likely,PDF memo,,
186,Litigation & Insurance,X.I,Product Recalls / Quality Issues / Liability Claims,"Description of any product recalls, material product quality issues, or pending/threatened product warranty or product liability claims in the past five years.","5-year history of product recalls, quality issues, and warranty/liability claims",Legal,false,,,Medium,Not Started,,,,,,,,Medium,Likely,PDF,,
187,Compliance & Government,XI.A,Government Citations/Notices (5 Years),"Citations, notices or inquiries received from government agencies within the last five years.",Compile government citations/notices/inquiries or confirm none,Legal,false,,,Medium,Not Started,,,,,,,,Low,Certain,PDF memo,,
188,Compliance & Government,XI.B,Reports to Government Agencies,All material reports to and correspondence with any governmental entity.,"Required government filings beyond tax (EEO-1, OSHA, etc.)",Legal,false,,,Medium,Not Started,,,,,,,,Low,Likely,PDF,,
189,Compliance & Government,XI.C,Regulatory Compliance Cost Estimates,Estimation and report on the burdens and costs of regulatory compliance.,"Estimate annual compliance spend (legal, security, privacy)",Legal,false,,,Medium,Not Started,,,,,,,,Medium,Likely,PDF or XLSX,,
190,Compliance & Government,XI.D,Government Permits/Licenses,"All material governmental approvals, permits, licenses presently in force, including those canceled or terminated.",All government permits and licenses (Perfection Certificate covers some),Legal,false,,,Medium,Not Started,,,,,,,,Low,Likely,PDF,,
191,Compliance & Government,XI.E,Pending/Threatened Investigations,Any pending or threatened investigations and governmental proceedings.,Confirm none or describe any pending government investigations,Legal,false,,,Medium,Not Started,,,,,,,,Low,Certain,PDF memo,,
192,Compliance & Government,XI.F,Government Correspondence,Material reports to and correspondence with any government agency.,Any material government correspondence beyond what's covered above,Legal,false,,,Low,Not Started,,,,,,,,Low,Likely,PDF,,
193,Compliance & Government,XI.G,Code of Conduct & Ethics/Compliance Policies,"Copy of the Company's code of conduct and all ethics, compliance, and anti-corruption policies including conflict of interest, whistleblower, and gifts/entertainment policies.","Code of conduct, ethics policy, anti-corruption policy, conflict of interest, whistleblower, gifts/entertainment",Legal,false,,,High,Not Started,,,,,,,,Medium,Certain,ZIP of PDFs,,
194,Compliance & Government,XI.H,Compliance Program Assessments & Audits,"Copies of all internal and external compliance program assessments and audits, including whistleblower reports (past 5 years), compliance training descriptions, and third-party diligence programs.","Compliance assessments/audits, whistleblower reports (5yr), training programs, and third-party diligence",Legal,false,,,Medium,Not Started,,,,,,,,Medium,Certain,ZIP of PDFs,,
195,Compliance & Government,XI.I,Escalated Compliance/Risk Issues (5 Years),"Accounting, internal controls, compliance, or risk management issues escalated to senior management or identified by internal audit in the last five years, and internal disciplinary actions/investigations.","5-year log of escalated compliance issues, internal audit findings, and disciplinary actions re officers/directors/employees",Legal,false,,,High,Not Started,,,,,,,,Medium,Certain,PDF,,
196,Compliance & Government,XI.J,FCPA / Anti-Corruption Compliance,"Documentation relating to compliance with FCPA, UK Bribery Act, or other anti-corruption laws, including voluntary self-disclosures.","FCPA/Bribery Act compliance docs, training materials, and any voluntary self-disclosures",Legal,false,,,High,Not Started,,,,,,,,Medium,Certain,PDF,,
197,Compliance & Government,XI.K,Government Official Interactions Policy,Description of policies/practices relating to interactions with government officials.,"Policies on gifts/travel/entertainment for govt officials, govt employees, SOE business, non-US political donations",Legal,false,,,Medium,Not Started,,,,,,,,Medium,Likely,PDF,,
198,Compliance & Government,XI.L,Facility & Individual Security Clearances,"Confirmation of facility security clearances, individual security clearances, and related security review documentation.",Confirm facility/individual security clearance status (likely N/A for SaaS),Legal,false,,,Low,Not Started,,,,,,,,Low,Unlikely,PDF memo,,
199,"Product, Sales & Support",XII.A,Product List & Roadmap,Provide a list of current and former products and product map/future release schedule.,"Product list with descriptions, target markets, version timeline",Engineering,false,,,High,Not Started,,,,,,,,Low,Certain,PDF,,
200,"Product, Sales & Support",XII.B,Customer Support Description,List and description of how customers have been supported thus far.,Description of customer support channels and methods,Support,false,,,Medium,Not Started,,,,,,,,Low,Certain,PDF,,
201,"Product, Sales & Support",XII.C,Support/Service Policies & Liabilities,Provide description and/or copy of customer support and service policies and liabilities.,Customer support/service policies including SLA terms and liabilities,"Support, Legal",false,,,Medium,Not Started,,,,,,,,Medium,Certain,PDF,,
202,"Product, Sales & Support",XII.D,"Sales Forms, Price Lists, Catalogs","Copies of all standard Company sales forms or literature, including price lists, catalogs, purchase orders.","Sales collateral, price lists, order forms",Finance,false,,,Medium,Not Started,,,,,,,,Low,Certain,PDF + XLSX,,
203,"Product, Sales & Support",XII.E,Support & Customer Care Org Structure,"Provide a description of the support and customer care organization structure and operations, including personnel breakdown by function.",Support org chart with headcount by function,Support,false,,,Medium,Not Started,,,,,,,,Low,Certain,PDF,,
204,"Product, Sales & Support",XII.F,Complete Customer List with ARR,"Complete customer list with contract start/end dates, renewal dates, and historical/current ARR by product.","Full customer list: contract dates, renewal dates, and ARR by product (historical and current)",Finance,false,,,High,Not Started,,,,,,,,High,Certain,XLSX,,
205,"Product, Sales & Support",XII.G,GTM Model & Sales Process Overview,"Overview of go-to-market model, routes to market, sales org structure, end-to-end sales process, comp plans by role, and average AE ramp time.","GTM overview: routes to market, sales org, lead-to-close process, comp plans, AE ramp time",Finance,false,,,High,Not Started,,,,,,,,Medium,Certain,PDF + XLSX,,
206,"Product, Sales & Support",XII.H,"Bookings, ARR & Pipeline Metrics","Historical and current bookings, ARR, and new logo data by quarter/product/region for past 3 years, with pipeline, funnel, velocity metrics, and deal size/sales cycle data.","3-year bookings/ARR/new logos by quarter, product, region + current pipeline metrics, deal size, sales cycle",Finance,false,,,High,Not Started,,,,,,,,High,Certain,XLSX,,
207,"Product, Sales & Support",XII.I,Partner & Alliance Programs,"Overview of partner and alliance programs, including partner-sourced/influenced revenue and partner pipeline.","Partner program overview: structure, partner-sourced vs influenced revenue %, and partner pipeline",Finance,false,,,Medium,Not Started,,,,,,,,Medium,Likely,PDF + XLSX,,
