#,Cluster,DD Ref,Title (Brief Description),Full Description,Plain English Ask,DRI,Requires DG Review,Requires Cooley Review,Owner,Priority,Status,GDrive Location1,GDrive Location2,GDrive Location3,GDrive Location4,GDrive Location5,P53 Share,Rathgar Share,LOE,Likelihood,Output Format,Dependency,Owner Notes
63,Employment Matters,V.C,Terminated Employees (Last 12 Months),"List of employees terminated within the past 12 months, a brief description of the circumstances of their termination and a statement as to whether the Company has any reason to believe that such former employee has violated any non-disclosure, non-competition, non-solicitation or similar agreement.","Termination list (12 months): name, date, reason, and NDA/non-compete compliance status",People,,,,High,Not Started,,,,,,,,Medium,Certain,XLSX,,
64,Employment Matters,V.D,PTO/Vacation/Sick Leave Balances,"List of each employee's balance to-date for vacation, sick leave and personal time-off.",Current PTO/vacation/sick balance by employee,Accounting,,,,High,Not Started,,,,,,,,Low,Certain,XLSX,,
65,Employment Matters,V.E,Employment Agreements & Offer Letters,Employment agreements and offer letters for current employees.,All current employee agreements and offer letters (forms + executive agreements),Legal,,,,High,Not Started,https://drive.google.com/drive/folders/13glnsSf6YjExOEY8oTKwNpP9Es6J1zou,https://drive.google.com/drive/folders/1qEKZ63fss-ZVVM3ss8DD7AU3vy5-MD9x,,,,,,Medium,Certain,ZIP of PDFs,,
66,Employment Matters,V.F,Prospective Employee Offer Letters,Offer letters for prospective employees.,"Any outstanding, unsigned offer letters for prospective hires",People,,,,Medium,Not Started,,,,,,,,Low,Likely,PDF,,
67,Employment Matters,V.G,Independent Contractor Agreements,List of all current and former independent contractors and copies of independent contractor agreements.,Contractor list (current + former) with copies of all agreements,"People, Legal",,,,Medium,Not Started,,,,,,,,Medium,Certain,XLSX + ZIP of PDFs,,
68,Employment Matters,V.H,Non-Competition Agreements,Noncompetition agreements between the Company and any employee or consultant.,Confirm no non-standard non-competes exist (P53 confirmed NONE),Legal,,,,Medium,Not Started,,,,,,,,Low,Certain,PDF memo,,
69,Employment Matters,V.I,Severance / Change-of-Control / Stay Bonus,"Agreements providing for: (i) severance benefits, acceleration benefits or other benefits upon termination of employment or in connection with a change in control; or (ii) 'stay bonuses.'","All severance, CoC acceleration, and stay bonus arrangements","People, Legal",,,,High,Not Started,,,,,,,,Medium,Certain,PDF,,
70,Employment Matters,V.J,Visa & Immigration Status,Visa and immigration status for each impacted employee.,"List of employees on work visas: type, expiration, sponsorship status",People,,,,High,Not Started,,,,,,,,Medium,Certain,XLSX,,
71,Employment Matters,V.K,Benefit Plans (Comprehensive),"Employee benefit and profit-sharing plan documents or arrangements related to employees of the Company, including: (i) stock option plans; (ii) stock purchase plans; (iii) deferred compensation plans; (iv) bonus and profit sharing plans; (v) incentive plans; (vi) sales compensation plans; (vii) pension and other retirement plans; (viii) severance plans; (ix) business travel accident, (x) workers' compensation, (xi) dependent care reimbursement plans, (xii) health and welfare plans; and (xiii) similar plans or arrangements.","All benefit plan documents across 13 categories (equity, deferred comp, bonus, pension, health, etc.)","People, Accounting",,,,High,Not Started,https://docs.google.com/spreadsheets/d/1t5WO-VvIUh9refrSwXUZsjpThLgQpG9i8Pt-tYjpOww,,,,,,,Medium,Certain,ZIP of PDFs,,
72,Employment Matters,V.L,Perquisites,Description of perquisites generally available to employees.,"List any employee perks beyond standard benefits (car allowances, housing, etc.)",Finance,,,,Low,Not Started,,,,,,,,Low,Likely,PDF memo,,
73,Employment Matters,V.M,Loans to / Guarantees for Employees,"Loans to, and guarantees for the benefit of employees.",List any employee loans or guarantees (137 Ventures loan to Eoghan already documented),Legal,,,,Medium,Not Started,,,,,,,,Low,Likely,PDF memo,,
74,Employment Matters,V.N,Employee Handbook & Policies,"Employee handbooks, manuals, guidelines and bulletins, benefit policies and any memoranda pertaining to the Company's policies on vacation, termination, promotion, discrimination, sexual harassment and similar matters.",Current employee handbooks (US/IE/UK/AU) and all HR policies,"People, Legal",,,,High,Not Started,,,,,,,,Low,Certain,ZIP of PDFs,,
75,Employment Matters,V.O,Labor Problems / Union Activities,Description of all significant labor problems or union activities. Copies of all collective bargaining agreements.,Confirm no union activity or labor disputes (negative confirmation memo),Legal,,,,Medium,Not Started,,,,,,,,Low,Certain,PDF memo,,
76,Employment Matters,V.P,Employment Disputes/Complaints (5 Years),"Provide description of all disputes, complaints, investigations and other proceedings relating to employment, occupational safety and health of employees during the last [five] years.","5-year log of employment disputes, EEOC complaints, OSHA matters, investigations","People, Legal",false,,,High,Not Started,,,,,,,,Medium,Certain,PDF,,
77,Employment Matters,V.Q,280G Parachute Payment Analysis,"Please provide 280G analysis, if applicable.","280G analysis — prepare comp inputs now, final calc after deal price is set","Tax , Legal , Cooley",false,,,High,Not Started,,,,,,,,High,Certain,XLSX + PDF,Deal price / structure,
78,Employment Matters,V.R,Multi-Year Hiring Plan,"Multi-year hiring plan, including current and projected headcount by department, attrition assumptions, and net new versus backfill roles by geography and function.","Hiring plan: projected headcount by dept, attrition assumptions, net new vs backfill by geo/function","Finance, People",false,,,Medium,Not Started,,,,,,,,Medium,Certain,XLSX,,
79,Employment Matters,V.S,Salary Increase History,"History of salary increases for each employee since hire, or for at least the past 24 months.",Individual salary increase history (at least 24 months),"People, Accounting",false,,,Medium,Not Started,,,,,,,,Medium,Likely,XLSX,,
80,Employment Matters,V.T,Anti-Solicitation / Hiring Policies,"Description of any policies (formal or informal) relating to soliciting or hiring employees from the Company's customers, suppliers, or partners.",Describe any policies restricting hiring from customers/suppliers/partners,Legal,false,,,Low,Not Started,,,,,,,,Low,Likely,PDF memo,,
81,Employment Matters,V.U,Background Check Practices,"Description of the Company's background check practices, including the scope of checks conducted and a list of employees who have completed them.",Background check policy and completion records,People,false,,,Medium,Not Started,,,,,,,,Low,Likely,PDF + XLSX,,
82,Employment Matters,V.V,Historical Employee Attrition Data,"Historical employee attrition data for the past three years, broken down by voluntary versus involuntary, with reason codes or top causes of attrition, including trends relating to regrettable attrition.","3-year attrition data: vol/invol split, reason codes, regrettable attrition trends","People, Finance",false,,,Medium,Not Started,,,,,,,,Medium,Certain,XLSX,,
83,Employment Matters,V.W,Reductions in Force / Furloughs,"Description of any reductions in force, workforce redundancies, or voluntary furlough programs in the past three years, including dates, locations, and number of employees affected.","Document any RIFs/layoffs/furloughs in past 3 years with dates, locations, headcount","People, Legal",false,,,Medium,Not Started,,,,,,,,Low,Certain,PDF,,
84,Employment Matters,V.X,Key Employee Outside Activities,"Description of any outside business activities undertaken by key employees (e.g., consulting, advisory roles, board positions at other companies).","List outside business activities of key employees (board seats, advisory roles, consulting)",Legal,false,,,Low,Not Started,,,,,,,,Low,Likely,PDF,,
85,Employment Matters,V.Y,Recruiting Cost & Training Time,"Estimated average recruiting cost per employee and average time to train a new employee, broken down by major functional department.",Average recruiting cost and training ramp time by department,"People, Finance",false,,,Medium,Not Started,,,,,,,,Medium,Likely,XLSX,,
86,Employment Matters,V.Z,Severance & Equity Performance Conditions,"Plan documents and terms for all redundancy, termination, and severance arrangements, including change of control payment terms. Description of whether any equity awards are subject to performance conditions, including the specific triggering criteria.","All severance/termination plan docs + equity performance condition details (PSU triggers, etc.)",Legal,false,,,High,Not Started,,,,,,,,Medium,Certain,PDF + XLSX,,
87,Employment Matters,V.AA,Comp & Benefits Calendar,"Calendar of compensation and benefits events, including payroll timing, performance reviews, salary increase cycles, bonus payment timing, stock refreshes, and company-specific holidays.","Annual calendar: payroll dates, review cycles, bonus timing, stock refresh, company holidays","People, Accounting",false,,,Medium,Not Started,,,,,,,,Low,Certain,XLSX or PDF,,
88,Employment Matters,V.BB,Accrued PTO Obligations,"Description of the Company's aggregate accrued obligations for accumulated vacation and sick leave, and confirmation of whether such balances are redeemable by employees.",Total accrued PTO liability and whether balances are redeemable/paid out on termination,Accounting,false,,,High,Not Started,,,,,,,,Low,Certain,PDF memo,,
89,Intellectual Property,VI.A,Patent Registrations & Applications,"Schedule of patent registrations and applications, identifying each by title, registration/application number, date, and country.","Patent schedule: title, number, date, country",Legal,false,,,Medium,Not Started,https://drive.google.com/drive/folders/115L2C2-IM9y2DYUUAFsi_S2S0zSRIDjG,,,,,,,Low,Certain,XLSX,,
90,Intellectual Property,VI.B,Trademark & Service Mark Registrations,Schedule of trademark and service mark registrations and applications.,"Trademark schedule: mark, date, number, status, country/state",Legal,false,,,Medium,Not Started,https://drive.google.com/drive/folders/115L2C2-IM9y2DYUUAFsi_S2S0zSRIDjG,,,,,,,Low,Certain,XLSX,,
91,Intellectual Property,VI.C,Copyright Registrations,Schedule of copyright registrations and applications.,"Copyright schedule: title, number, date",Legal,false,,,Medium,Not Started,https://drive.google.com/drive/folders/115L2C2-IM9y2DYUUAFsi_S2S0zSRIDjG,,,,,,,Low,Certain,XLSX,,
92,Intellectual Property,VI.D,Mask Work Registrations,Schedule of mask work registrations and applications.,Mask work schedule — likely N/A for software company,Legal,false,,,Low,Not Started,,,,,,,,Low,Unlikely,PDF memo,,
93,Intellectual Property,VI.E,Trade Secrets & Secrecy Procedures,Schedule of trade secrets. Manual or other written document detailing the procedures for maintaining the secrecy of trade secrets of the Company.,Trade secret inventory and secrecy procedures documentation,"Legal, Engineering",false,,,Medium,Not Started,,,,,,,,Medium,Likely,PDF,,
94,Intellectual Property,VI.F,PIIA / Confidentiality Agreements,"Forms of proprietary information and inventions, confidentiality and non-competition agreements with current and former employees and consultants. Material deviations from forms. Invention disclosures.","PIIA forms, signed copies for key employees, any deviations, and invention disclosures",Legal,false,,,High,Not Started,https://drive.google.com/drive/folders/1wpYm3B2nLA3x8blW571kLteVTWJ-wmgy,https://drive.google.com/drive/folders/1OCtpuU9fk0XQhIyL-GIfKcnKZqw3PXm2,,,,,,Low,Certain,ZIP of PDFs,,
95,Intellectual Property,VI.G,License Agreements,License agreements (naming the Company as licensee or licensor).,All IP license agreements (inbound and outbound),Legal,false,,,Medium,Not Started,,,,,,,,Medium,Certain,ZIP of PDFs,,
96,Intellectual Property,VI.H,Government Grants for IP Development,List of any government grants or funding received by the Company in connection with its development of intellectual property.,List IDA Ireland grants and any other government IP funding,Legal,false,,,Medium,Not Started,,,,,,,,Low,Certain,PDF + XLSX,,
97,Intellectual Property,VI.I,IP Infringement Correspondence,"Communications to or from third parties relating to the validity or infringement of the Company's patents, trade secrets, trademarks, copyrights and other intellectual property rights.",Any IP infringement allegations or correspondence,Legal,false,,,Medium,Not Started,https://drive.google.com/drive/folders/1sKcm4znKDEFUcgrX4haQm2taBr5v-5MA,,,,,,,Low,Certain,PDF,,
98,Intellectual Property,VI.J,IP-Related Agreements (10 sub-categories),"All agreements relating to patents, copyrights, trademarks, trade secrets or other IP or technology, including: (a) acquired/transferred IP; (b) exclusively licensed IP; (c) third-party licensed/embedded IP; (d) outbound IP licenses; (e) affiliate IP transfers; (f) royalty/licensing payments; (g) joint ventures/development; (h) employee IP assignments/NDAs; (i) restricted-use development; (j) outsourcing/maintenance agreements.","Comprehensive IP agreement inventory across 10 categories (acquisitions, licenses in/out, affiliates, royalties, JVs, assignments, outsourcing)",Legal,false,,,High,Not Started,,,,,,,,High,Certain,ZIP of PDFs,,
99,Intellectual Property,VI.K,IP Indemnities,Copies of any indemnities or standard form of indemnity provided by the Company to third parties regarding intellectual property rights.,Standard IP indemnity form and any non-standard indemnities in contracts,Legal,false,,,Medium,Not Started,,,,,,,,Medium,Likely,PDF,,
100,Intellectual Property,VI.L,IP Transfer Agreements,Agreements pursuant to which any intellectual property used in the current or contemplated Business has been sold or transferred by or to the Company and evidence of recording thereof.,Any IP sale/transfer agreements and recording evidence,Legal,false,,,Medium,Not Started,,,,,,,,Low,Certain,PDF,,
101,Intellectual Property,VI.M,AI/ML Product Description & Governance,"Description of any machine learning, artificial intelligence, or other automated decision-making products or features, including training data, model governance, and licensing/ownership issues related to AI-generated outputs.","Describe all AI/ML products (Fin, etc.): training data, model governance, IP ownership of outputs","Engineering, Legal",false,,,High,Not Started,,,,,,,,Medium,Certain,PDF,,
102,Intellectual Property,VI.N,Generative AI Usage in IP Development,"Description of the Company's use of generative AI tools in developing Company IP, including policies for human review and restrictions from AI tool licenses.","Document use of generative AI in product development: tools used, human review policies, license restrictions","Engineering, Legal",false,,,High,Not Started,,,,,,,,Medium,Certain,PDF,,
103,Intellectual Property,VI.O,AI/ML Governance & Oversight Structure,"Description of the governance and oversight structure for AI/ML products, including responsibility for managing products, trustworthiness, and data governance.","AI/ML governance structure: who owns AI products, trustworthiness standards, data governance",Engineering,false,,,Medium,Not Started,,,,,,,,Medium,Certain,PDF,,
104,Intellectual Property,VI.P,AI/ML Training Data Sources,"Description of the sources of data used to train AI/ML models, including whether customer data trains models benefiting other customers, contractual protections, and consents.","Training data inventory: sources, customer data usage/isolation, contractual protections, consents","Engineering, Legal",false,,,High,Not Started,,,,,,,,Medium,Certain,PDF,,
105,Intellectual Property,VI.Q,Web Scraping / Automated Data Collection for AI,"Description of any use of web scraping or other automated data collection methods in connection with the Company's AI/ML products, and the legal basis for such collection.",Document any web scraping or automated data collection for AI/ML and legal basis,"Engineering, Legal",false,,,Medium,Not Started,,,,,,,,Low,Likely,PDF,,
106,Intellectual Property,VI.R,Open-Source AI/ML Models,"Description of any open or open-source AI/ML models used by the Company, including applicable license terms and any restrictions on commercial use.","List open-source AI/ML models used, license terms, and commercial use restrictions",Engineering,false,,,Medium,Not Started,,,,,,,,Medium,Certain,XLSX,,
107,Intellectual Property,VI.S,AI/ML IP Indemnities & Claims,"Description of IP indemnities provided to customers in connection with AI/ML products, including any claims made or defended.",AI/ML-specific IP indemnity terms and any claims history,Legal,false,,,High,Not Started,,,,,,,,Medium,Certain,PDF,,
108,Intellectual Property,VI.T,AI Confidentiality & Data Rights Tracking,Description of policies governing disclosure of confidential information to third-party AI services and the Company's data rights-tracking system for AI/ML data.,Policies for confidential data in third-party AI tools and data rights tracking,"Legal, Engineering",false,,,Medium,Not Started,,,,,,,,Medium,Likely,PDF,,
109,Intellectual Property,VI.U,"AI/ML Feedback, Complaints & Criticisms","Description of mechanisms to receive/address feedback about AI/ML products and summary of claims, complaints, regulatory inquiries, or published criticisms.","AI/ML feedback channels and log of any complaints, regulatory inquiries, or public criticisms","Legal, Engineering",false,,,Medium,Not Started,,,,,,,,Medium,Likely,PDF,,
110,Intellectual Property,VI.V,AI-Assisted Copyright Disclosures,"Where registered copyrights exist in AI-assisted works, description of disclosures to U.S. Copyright Office re AI involvement.",Any AI-related disclosures made to Copyright Office for registered works,Legal,false,,,Low,Not Started,,,,,,,,Low,Unlikely,PDF memo,,
111,Intellectual Property,VI.W,Social Media Accounts,List of all social media account names or handles used by the Company in connection with its business.,"List all company social media handles (Twitter/X, LinkedIn, etc.)",Comms,false,,,Low,Not Started,,,,,,,,Low,Certain,XLSX,,
112,Software / IT Systems,VII.A,Material IT/Software Systems Inventory,List of all material IT/software systems used by the Company.,"Inventory of all material IT systems with vendor, cost, contract end date","Engineering, IT",false,,,High,Not Started,,,,,,,,Medium,Certain,XLSX,,
113,Software / IT Systems,VII.B,Proprietary/Customized Software,List of all proprietary or customized software used by the Company.,List proprietary and customized software,Engineering,false,,,Medium,Not Started,,,,,,,,Medium,Likely,XLSX,,
114,Software / IT Systems,VII.C,IT Outsourcing Arrangements,List of all outsourcing arrangements relating to IT or other systems and copies of contracts.,IT outsourcing list including Boldr (CS BPO) with contracts,"IT, Procurement",false,,,Medium,Not Started,,,,,,,,Low,Likely,XLSX + PDF,,
115,Software / IT Systems,VII.D,Hosting Arrangements,List of all hosting and similar arrangements and copies of contracts.,"Document hosting infrastructure (AWS primary): architecture, regions, spend, contracts","Engineering, Procurement",false,,,High,Not Started,,,,,,,,Low,Certain,PDF memo,,
116,Software / IT Systems,VII.E,SaaS/Cloud Computing Agreements,"Describe the Company's use of SaaS, ASP or cloud computing and provide copies of agreements.",Material SaaS vendor contracts and cloud computing agreements,"IT, Procurement",false,,,Medium,Not Started,,,,,,,,Medium,Certain,XLSX + ZIP,,
117,Software / IT Systems,VII.F,Development Tools & Third-Party Technology,"List of software development tools, platforms, APIs or other third party technology used in development, use or maintenance of the Company's products.","Dev tools, platforms, and third-party tech used in product development",Engineering,false,,,Medium,Not Started,,,,,,,,Low,Likely,XLSX,,
118,Software / IT Systems,VII.G,Open Source Software Inventory,List all open source software used or embedded in the Company's products and services.,"Full OSS inventory: component, version, license, modifications, distribution method, source URL",Engineering,false,,,High,Not Started,https://docs.google.com/document/d/1Y7uBce2M2jngpqCISAXdKwVrP1ySm4MVEolGwxGUvn8,https://docs.google.com/spreadsheets/d/1IoYBMYEAPSekC7WCt71lDkUDRKkImDTqMFeXzmWaGMs,,,,,,Low,Certain,XLSX,,
119,Software / IT Systems,VII.H,Source Code Escrow / Disclosure,"Copies of all agreements obligating the Company to provide source code to a third party, with confirmation on any actual disclosures.",Source code escrow agreements and any actual disclosures,Legal,false,,,Medium,Not Started,,,,,,,,Low,Certain,PDF,,
120,Software / IT Systems,VII.I,Standards Body Memberships,"List all industry standards bodies the Company is now or was a member/promoter of, or contributor to.","Confirm any W3C, IETF, etc. memberships — likely minimal",Engineering,false,,,Low,Not Started,,,,,,,,Low,Unlikely,PDF memo,,
121,Software / IT Systems,VII.J,Technical Architecture & Infrastructure Diagrams,"Technical architecture and infrastructure diagrams, including data center configurations, logical network diagrams, customer data flow diagrams, and load balancing and high availability configurations.","Architecture diagrams: data centers, network, data flow, HA/load balancing",Engineering,false,,,High,Not Started,,,,,,,,Medium,Certain,PDF / Diagrams,,
122,Software / IT Systems,VII.K,API Specifications & Data Overview,"Key API technical specifications and documentation, and an overview of the size and nature of data under management.","API specs/docs and overview of data under management (schemas, volumes)",Engineering,false,,,Medium,Not Started,,,,,,,,Medium,Certain,PDF,,
123,Software / IT Systems,VII.L,Production Systems & R&D Tools Inventory,"Inventory of all production systems, development and production environments, and R&D tools used in the SDLC.","Full inventory: prod systems, dev/prod environments, and SDLC tools (repos, CI/CD, QA, security scanning, monitoring)",Engineering,false,,,Medium,Not Started,,,,,,,,Medium,Certain,XLSX,,
124,Software / IT Systems,VII.M,Product Planning Docs & Roadmap,"Examples of product planning and requirements documentation (PRDs/BRDs), and the high-level product roadmap, including contractual commitments to customers regarding future features.","Sample PRDs/BRDs, product roadmap, and any contractual feature commitments to customers",Engineering,false,,,Medium,Not Started,,,,,,,,Medium,Certain,PDF + XLSX,,
125,Software / IT Systems,VII.N,Change/Incident/Storage/Failover Policies,"Policy and process documentation governing change management, incident management, data storage, and failover processes.","Change management, incident management, data storage, and failover policy docs + bug triage process",Engineering,false,,,Medium,Not Started,,,,,,,,Medium,Certain,PDF,,
126,Software / IT Systems,VII.O,Product Usage & Adoption Metrics,"Key product usage and adoption metrics, including MAU, feature usage and attach rates, and third-party integrations.","MAU by persona, feature usage/attach rates, and list of common customer integrations","Engineering, Finance",false,,,High,Not Started,,,,,,,,Medium,Certain,XLSX,,
127,Software / IT Systems,VII.P,Client Endpoint & Device Inventory,"Inventory of all client endpoints assigned to employees, mobile device policy, and all applications for core business functions.","Employee device inventory (laptops, mobile), BYOD/corp policy, and core business app list",IT,false,,,Medium,Not Started,,,,,,,,Low,Likely,XLSX,,
128,Software / IT Systems,VII.Q,Cloud Environments & Identity/SSO,"Description of cloud environments for corporate/operational purposes, including access/auth methods and identity/SSO services.","Cloud environment overview with access controls, auth methods, and SSO/identity services","IT, Engineering",false,,,Medium,Not Started,,,,,,,,Medium,Certain,PDF,,
129,Software / IT Systems,VII.R,Network & Data Center Overview,Overview of standard network technology in offices and description of data centers (owned or third-party managed).,Office network overview (WAN/LAN/VPN) and data center descriptions,"IT, Engineering",false,,,Medium,Not Started,,,,,,,,Low,Likely,PDF,,
130,Privacy & Information Security,VIII.A,Privacy/Security Responsible Individuals,Identify the individual(s) by name and title who are responsible for (i) privacy compliance and (ii) information security.,"Names + titles of DPO, CISO, privacy counsel","Legal, Security Team",false,,,Medium,Not Started,,,,,,,,Low,Certain,PDF memo,,
131,Privacy & Information Security,VIII.B,Countries of Operation,In which countries does the Company operate or market/offer its products and services?,List all countries where Intercom operates or sells,Legal,false,,,Medium,Not Started,,,,,,,,Low,Certain,XLSX,,
132,Privacy & Information Security,VIII.C,Revenue by Country,Please provide a percentage breakdown of business revenue by country.,Revenue breakdown by country (% of total),Finance,false,,,Medium,Not Started,,,,,,,,Low,Certain,XLSX,,
133,Privacy & Information Security,VIII.D,Data Categories by Individual Type,Describe each category of individuals about whom the Company processes personal data.,"Data mapping: what data, for whom (employees, customers, end-users, prospects), by what means","Legal, Security Team",false,,,High,Not Started,,,,,,,,Medium,Certain,PDF or XLSX,,
